{
  "_comment": "Single source of truth for the declared Zephyr SDK cross-toolchain pin. This is not alp.lock: that generated file records what a workspace resolved after installation. scripts/check_toolchain_lock.py validates this schema, derives the SDK version from the Zephyr revision pinned by metadata/bootstrap.json, and prevents this repo's workflows from hardcoding an independent version or unverified download -- the exact derivation that makes a value like the historical SDK_VER=0.16.8 literal in pr-renode-aen-smoke.yml (pinned to no Zephyr revision this repo has ever built against) impossible to reintroduce unnoticed. Python Tan mirrors the version in python/tan/commands/doctor_cmd.py and asserts parity in tan-cli's own tests. Scope (#1012): the gate scans only THIS repo's .github/workflows -- a consumer in another repo is outside it entirely, and a new consumer of this pin needs its own parity assertion; widening the scan will not reach it. Per ADR 0021, artifacts use pinned upstream URLs and sha256 values and are never rehosted. The upstream linux-aarch64 archive is deliberately omitted until a current alp-sdk path consumes it.",
  "schemaVersion": 1,
  "zephyrSdk": {
    "version": "1.0.1",
    "versionDerivation": "Equal to the `SDK_VERSION` file at the Zephyr revision metadata/bootstrap.json's `zephyr.version` pins (currently v4.4.1) -- verified with `git show <zephyr.version>:SDK_VERSION` against the Zephyr checkout, not copied by hand. scripts/check_toolchain_lock.py re-derives and asserts this at every run.",
    "baseUrl": "https://github.com/zephyrproject-rtos/sdk-ng/releases/download/v1.0.1/",
    "artifacts": [
      {
        "host": "linux-x86_64",
        "component": "minimal-sdk",
        "filename": "zephyr-sdk-1.0.1_linux-x86_64_minimal.tar.xz",
        "sizeBytes": 70650944,
        "sha256": "ca9bc0ff66fafca1dac9d592a36d953cf16d096a9d09b1c0357f021cf9f6a7eb"
      },
      {
        "host": "linux-x86_64",
        "component": "arm-zephyr-eabi-toolchain",
        "filename": "toolchain_gnu_linux-x86_64_arm-zephyr-eabi.tar.xz",
        "sizeBytes": 101752776,
        "sha256": "21b85981cb5a1818d9bc53d82af80f208946ec038b982ff1907287572ed3a634"
      },
      {
        "host": "windows-x86_64",
        "component": "minimal-sdk",
        "filename": "zephyr-sdk-1.0.1_windows-x86_64_minimal.7z",
        "sizeBytes": 104319274,
        "sha256": "17a557e7c6cea5e5c589508fe45a3f26aca4fa2c6153fe3e7b03aeb4b93fea4b"
      },
      {
        "host": "windows-x86_64",
        "component": "arm-zephyr-eabi-toolchain",
        "filename": "toolchain_gnu_windows-x86_64_arm-zephyr-eabi.7z",
        "sizeBytes": 79217349,
        "sha256": "d08df2e83378dc8d28d0c67ab72d021ca633344b7a2bc053ababf9b8e677aa8d"
      },
      {
        "host": "macos-aarch64",
        "component": "minimal-sdk",
        "filename": "zephyr-sdk-1.0.1_macos-aarch64_minimal.tar.xz",
        "sizeBytes": 87942056,
        "sha256": "867063901f39528a6175a80ebc20367bd6cb440593e7e2650eda30392f1f6b65"
      },
      {
        "host": "macos-aarch64",
        "component": "arm-zephyr-eabi-toolchain",
        "filename": "toolchain_gnu_macos-aarch64_arm-zephyr-eabi.tar.xz",
        "sizeBytes": 89958448,
        "sha256": "4008edb5d4840cd994aedd7f1309bfb63e7243729d57839ebf1cc83c1f17c886"
      }
    ]
  },
  "measuredFootprint": {
    "notes": [
      "Measured on a real host, not estimated -- this replaces docs/adr/0021-toolchain-provisioning.md's Open-evidence item on real per-artifact sizes: that ADR's ~1 GB (minimal SDK + arm-zephyr-eabi) to ~17 GB (full bundle) figures were a comment in pr-twister.yml, never a measurement, and both directions turn out wrong here.",
      "Compressed download, linux-x86_64 minimal-sdk + arm-zephyr-eabi-toolchain: 70650944 + 101752776 = 172403720 bytes (~164 MiB) -- the ADR's ~1 GB estimate for the same pair was ~6x too high.",
      "Extracted on disk for that same minimal + arm-zephyr-eabi install (du -sb): whole SDK 2026739200 bytes (~1.89 GiB); hosttools/ 1242632545 bytes (~1.16 GiB); gnu/arm-zephyr-eabi/ 784086497 bytes (~748 MiB).",
      "Design consequence: hosttools/ is 61% of the on-disk footprint -- larger than the compiler itself -- and is what carries `dtc`. `west sdk install` installs it by default (sdk.py:452: `if not args.interactive and not args.no_hosttools`). `--no-hosttools` nearly halves the on-disk store but loses `dtc`, which ties directly to ADR 0021's still-open dtc/gperf-on-Windows question. This file states the trade-off; it does not resolve it.",
      "Scope honesty: the windows-x86_64 and macos-aarch64 artifact rows above are verified identity facts (URL, size, sha256) -- what those bundles CONTAIN (does the Windows minimal SDK ship `dtc`? `gperf` is confirmed absent) is still open per ADR 0021 and is deliberately not recorded or implied here."
    ],
    "compressedDownloadBytes": {
      "linux-x86_64-minimal-plus-arm-zephyr-eabi": 172403720
    },
    "extractedBytes": {
      "wholeSdk": 2026739200,
      "hosttools": 1242632545,
      "gnuArmZephyrEabi": 784086497
    }
  }
}
